{
  "id": "freeads",
  "root_domain": "freeads.co.uk",
  "analysed_on": "2026-09-25",
  "keywords": {
    "status": "ok",
    "values": [
      "staffordshire bull terriers for sale",
      "staffordshire bull terrier puppies",
      "staffy cross alpha blue",
      "blue merle dna clear staffy puppies",
      "blue merle dna clear staffy",
      "blue merle staffordshire bull terrier puppies",
      "staffy puppies",
      "staffy cross puppies",
      "staffy x frenchie puppies",
      "blue staffy",
      "blue staffordshire bull terrier puppies",
      "blue staffordshire bull terrier",
      "blue staffy puppies",
      "staffy puppies for sale",
      "blue staffys",
      "kc registered red brindle black staffy",
      "staffordshire bull terrier american staffy puppies",
      "staffie puppies for sale",
      "blue staffy x shar pei puppies",
      "staffy x shar pei puppies",
      "staffy puppy",
      "blue black and white staffy",
      "kc registered staffy",
      "staffy x puppies",
      "blue staffies",
      "staffordshire bull terriers puppies",
      "kc registered staffordshire bull terrier puppies",
      "staffy x american bulldog puppies",
      "puppies we have 6 gorgeous staffy"
    ]
  },
  "page_types": {
    "status": "ok",
    "values": {
      "about": 1,
      "breed-guide": 2,
      "city": 13,
      "listing": 5
    }
  },
  "cities": {
    "status": "ok",
    "values": [
      "Aberdeen",
      "Birmingham",
      "Bristol",
      "Cornwall",
      "Coventry",
      "Essex",
      "Glasgow",
      "Hull",
      "Leeds",
      "Leicester",
      "Liverpool",
      "London",
      "Manchester",
      "Nottingham",
      "Oxford",
      "South Yorkshire",
      "Sunderland",
      "Wolverhampton",
      "York"
    ]
  },
  "schema_types": {
    "status": "ok",
    "values": [
      "Organization",
      "ImageObject",
      "WebSite"
    ]
  },
  "pages": {
    "status": "ok",
    "fetched_on": "2026-09-25",
    "values": [
      {
        "url": "https://www.freeads.co.uk/",
        "title": "Puppies, Kittens, Dogs & Cats for Sale | Post Free Ads | Freeads Pets",
        "h1": "Finding Pets Forever Homes",
        "h2": [
          "Select a location",
          "Lovely pets are waiting for you",
          "Latest Video Ads",
          "Ads from",
          "Recently Viewed Ads",
          "See our lovely rescues",
          "Lovely pets are waiting for you",
          "Latest Video Ads",
          "Ads from",
          "Recently Viewed Ads",
          "See our lovely rescues",
          "Boosted Adverts",
          "Rescue pets",
          "Dogs for sale",
          "Cats for sale",
          "Horses for sale",
          "Other pets",
          "Rescue pets",
          "Dogs for sale",
          "Cats for sale",
          "Horses for sale",
          "Other pets"
        ]
      },
      {
        "url": "https://www.freeads.co.uk/uk/buy-sell/pets/dogs/staffordshire-bull-terrier/",
        "title": "Staffordshire Bull Terrier Puppies and Dogs  for sale  | Freeads Pets",
        "h1": "Staffordshire Bull Terrier Puppies & Dogs For Sale",
        "h2": [
          "Refine your results",
          "You might also like",
          "Latest featured ads in Staffordshire Bull Terrier",
          "Buyer's Advice"
        ]
      },
      {
        "url": "https://www.freeads.co.uk/about-us",
        "title": "About Us | Freeads Pets - Safe & Trusted Pet Rehoming",
        "h1": "About Freeads Pets",
        "h2": [
          "The UK's Favourite Marketplace  for Responsible Pet Rehoming",
          "Our Story",
          "Why we are now only Pets",
          "Pet Welfare is always first",
          "Built for Pet Lovers",
          "What our users say"
        ]
      }
    ]
  },
  "trust": {
    "status": "ok",
    "values": {
      "council_licence_shown": true,
      "council": null,
      "kc_registration_mentioned": true,
      "health_tests_named": [
        "hip and elbow scores",
        "L-2-HGA",
        "HC-HSF4"
      ],
      "vet_checks_mentioned": true,
      "breeding_since_as_worded": null,
      "town": null,
      "phone_shown": false,
      "email_shown": false,
      "contact_source": "raw-html",
      "reviews_shown": 15
    }
  },
  "content": {
    "status": "ok",
    "values": {
      "homepage_words": 3608,
      "url_count": 88,
      "h2_per_page": {
        "https://www.freeads.co.uk/": 22,
        "https://www.freeads.co.uk/uk/buy-sell/pets/dogs/staffordshire-bull-terrier/": 4,
        "https://www.freeads.co.uk/about-us": 6
      }
    }
  },
  "blog": {
    "status": "ok",
    "values": {
      "post_count": 0,
      "post_folder": null,
      "topics": {
        "status": "NOT FETCHED",
        "reason": "no post fetched: the classifier counts no post, and none of its key pages is a post"
      },
      "posting_frequency": {
        "status": "NOT FETCHED",
        "reason": "no dated post URL in the map list and no post fetched"
      },
      "sampled_word_counts": {
        "status": "NOT FETCHED",
        "reason": "no post fetched: the classifier counts no post, and none of its key pages is a post"
      }
    }
  },
  "visual": {
    "status": "ok",
    "values": {
      "homepage_images": 270,
      "alt_text": "descriptive",
      "alt_missing": 8,
      "video_present": false
    }
  },
  "conversion": {
    "status": "ok",
    "values": {
      "cta_types": [
        "phone",
        "whatsapp",
        "visit"
      ],
      "prices_shown": true,
      "price_amounts_as_printed": [
        "£1.5",
        "£3",
        "£6",
        "£10",
        "£11",
        "£30",
        "£50",
        "£80",
        "£95",
        "£100",
        "£150",
        "£200",
        "£250",
        "£299",
        "£300",
        "£350",
        "£400",
        "£450",
        "£500",
        "£550",
        "£599",
        "£600",
        "£650",
        "£700",
        "£800",
        "£850",
        "£900",
        "£950",
        "£1,000",
        "£1,150",
        "£1,200",
        "£1,250",
        "£1,300",
        "£1300",
        "£1,400",
        "£1400",
        "£1,500",
        "£1500",
        "£1,600",
        "£1,700",
        "£1,800",
        "£2,000",
        "£2,100",
        "£2,200",
        "£2,250",
        "£2,300",
        "£2,495",
        "£2,500",
        "£2,600",
        "£2,800"
      ],
      "deposit_terms": "no platform deposit terms on the pages fetched; sellers set their own in their adverts, one saying a deposit secures a puppy and another taking deposits from a stated date, with no deposit amount printed",
      "steps_to_enquire": null,
      "urgency_signals": [
        "ready-date",
        "few-left",
        "waiting-list"
      ]
    }
  },
  "technical": {
    "status": "ok",
    "values": {
      "mobile_layout_ok": true,
      "lighthouse_performance": {
        "status": "NOT FETCHED",
        "reason": "no Lighthouse run"
      }
    }
  },
  "key_insight": "Freeads ranks for Staffy searches with one indexable UK-wide Staffordshire Bull Terrier hub: a feed of a couple of hundred private adverts, many of them crosses and rehomes, where every KC, health-test or licence claim is the seller's word and the only checks are the platform's. BSUK can beat that hub with one breeder's own blue Staffy pages that show what a feed cannot: named health results, a stated price and deposit, the parents, and a direct enquiry."
}
