{
 "id": "foreverpuppy",
 "root_domain": "foreverpuppy.co.uk",
 "analysed_on": "2026-09-25",
 "keywords": {
  "status": "ok",
  "values": [
   "blue staffy",
   "puppy staffordshire bull terrier",
   "staffordshire bull terrier puppies",
   "staffordshire bull terrier puppy",
   "staffy pup for sale"
  ]
 },
 "page_types": {
  "status": "ok",
  "values": {
   "blog": 1,
   "city": 16,
   "health": 1,
   "listing": 18
  }
 },
 "cities": {
  "status": "ok",
  "values": [
   "Bristol",
   "Cardiff",
   "Essex",
   "London",
   "Newcastle-under-Lyme",
   "South Yorkshire"
  ]
 },
 "schema_types": {
  "status": "ok",
  "values": [
   "Organization"
  ]
 },
 "pages": {
  "status": "ok",
  "fetched_on": "2026-09-25",
  "values": [
   {
    "url": "https://www.foreverpuppy.co.uk/",
    "title": "Puppies for Sale  - Forever Puppy",
    "h1": "Find your forever puppy",
    "h2": [
     "Featured Adverts",
     "Popular Dog Breeds for Sale",
     "Guides & Resources",
     "Sign in"
    ]
   },
   {
    "url": "https://www.foreverpuppy.co.uk/find-your-dog/staffordshire-bull-terrier",
    "title": "Staffordshire Bull Terrier Dogs and Puppies - Forever Puppy",
    "h1": "",
    "h2": [
     "Featured adverts",
     "All other listings",
     "Guides & Resources",
     "Our Forever Puppy app!",
     "Sign in"
    ]
   },
   {
    "url": "https://www.foreverpuppy.co.uk/find-your-dog/staffordshire-bull-terrier/near/bristol",
    "title": "Staffordshire Bull Terrier Dogs and Puppies - Forever Puppy",
    "h1": "",
    "h2": [
     "Featured adverts",
     "All other listings",
     "Guides & Resources",
     "Our Forever Puppy app!",
     "Sign in"
    ]
   }
  ]
 },
 "trust": {
  "status": "ok",
  "values": {
   "council_licence_shown": false,
   "council": null,
   "kc_registration_mentioned": false,
   "health_tests_named": [],
   "vet_checks_mentioned": false,
   "breeding_since_as_worded": null,
   "town": null,
   "phone_shown": false,
   "email_shown": false,
   "contact_source": "raw-html",
   "reviews_shown": 0
  }
 },
 "content": {
  "status": "ok",
  "values": {
   "homepage_words": 949,
   "url_count": {
    "status": "NOT FETCHED",
    "reason": "map truncated at 500"
   },
   "h2_per_page": {
    "https://www.foreverpuppy.co.uk/": 4,
    "https://www.foreverpuppy.co.uk/find-your-dog/staffordshire-bull-terrier": 5,
    "https://www.foreverpuppy.co.uk/find-your-dog/staffordshire-bull-terrier/near/bristol": 5
   }
  }
 },
 "blog": {
  "status": "ok",
  "values": {
   "post_count": 1,
   "post_folder": "guides-resources-and-news",
   "topics": {
    "status": "NOT FETCHED",
    "reason": "no post fetched: none of the classifier's key pages is a post"
   },
   "posting_frequency": {
    "status": "NOT FETCHED",
    "reason": "post URLs carry no dates and no post was fetched"
   },
   "sampled_word_counts": {
    "status": "NOT FETCHED",
    "reason": "no post fetched: none of the classifier's key pages is a post"
   }
  }
 },
 "visual": {
  "status": "ok",
  "values": {
   "homepage_images": 9,
   "alt_text": "descriptive",
   "alt_missing": 1,
   "video_present": false
  }
 },
 "conversion": {
  "status": "ok",
  "values": {
   "cta_types": [],
   "prices_shown": true,
   "price_amounts_as_printed": [
    "£300",
    "£500",
    "£650",
    "£700",
    "£750",
    "£800",
    "£900",
    "£950",
    "£1,000",
    "£1,290",
    "£1,300",
    "£1,350",
    "£1,500",
    "£2,000",
    "£2,750"
   ],
   "deposit_terms": null,
   "steps_to_enquire": null,
   "urgency_signals": [
    "ready-date",
    "few-left"
   ]
  }
 },
 "technical": {
  "status": "ok",
  "values": {
   "mobile_layout_ok": true,
   "lighthouse_performance": {
    "status": "NOT FETCHED",
    "reason": "no Lighthouse run"
   }
  }
 },
 "key_insight": "Forever Puppy ranks for Staffy searches with an all-breed advert board whose Staffy and 'near Bristol' pages show the same national list of sellers' adverts and wanted posts, with no breed text, no health or licence proof and no local content. BSUK can beat it with real city pages and one breeder's visible proof: named health tests, a council licence, a printed price and a direct way to enquire."
}